0,最近的银行在哪儿,"您好，大厅入口处右侧5米有贵阳银行，入口上方平台处有工商银行,入口处左侧200米有农商银行。"
1,附近有建设银行吗,您好，大厅附近1公里内没有建设银行网点，距离最近的建设银行在观山湖区长岭南路世纪金源财富中心处，距离大概1.4公里。
2,卫生间在哪儿,您好，从大厅正门进入，左侧通道（1号窗口旁边）出去就是卫生间，按照大厅指示牌前往即可。
3,电梯在哪儿,您好，从大厅入口处左侧楼梯上到1楼平台（工商银行旁边）。
4,停车场在哪儿,您好，可从阳关大道右转湖滨路150米后再右转毕节路50米，进入交勘院A座负四层免费停车（发放停车卡，事项办理完毕后在咨询台盖章，凭卡出库）。
5,停车场收费吗,您好，如前来大厅办理业务可免费在停车场停车，入场时发放停车卡，事项办理完毕后在咨询台盖章，凭卡出库。
6,哪儿可以复印,您好，大厅咨询台有提供免费复印服务。
7,附近哪儿可以买东西,您好，从大厅正门对直穿过马路，左转前行200米处阳关小区有便利店，可购买物品。
8,我东西丢了，怎么办,您好，您可前往大厅咨询台失物保管处问询。
9,附近哪有吃饭的地方,您好，大厅门口左侧100米处有“播种吧”餐厅，右侧100米处有多家餐馆，从大厅正门对直穿过马路，左转前行200米处便是阳关小区，有多家餐饮店，均可就餐。
10,哪儿有水杯,您好，大厅各饮水机处及咨询台处均有水杯，可免费领取。
11,大厅哪儿可以充电,您好，大厅配备有自助共享充电宝，在大厅咨询台右后方，您可自行使用。
12,大厅有WIFI吗,"您好，大厅有提供WIFI,号码为GXQZWDT，未设置密码，您可自行连接使用。"
13,大厅食堂办事群众可以吃饭不,您好，食堂不对外开放。
14,大厅附近有公交车可以到贵阳吗,您好，从大厅正门处沿马路向下直行20米或对直穿过马路均有公交站台，沿马路前行1.5公里处有地铁站，均可直达贵阳市内。
15,大厅附近有派出所吗,您好，离此最近的派出所是金岭派出所，从大厅正门出去后右转直行大概350米到达。
16,市政务服务中心怎么走,您好，贵阳市政务服务中心位于贵阳市观山湖区市级行政中心二期办公楼A区负一楼，若是自行驾车，距离我区大约需要耗时20分钟左右。
17,社保在哪儿交,您好，公司社保您请前往观山湖区社保局咨询办理，电话咨询请拨打：0851-87981640；个人社保您请前往白云区社保局咨询办理，电话咨询请拨打：0851-84485067。
18,残保金在哪儿办,您好，办理残保金请在导税台取号，在税收服务窗口办理。
19,哪儿可以领停车卡,您好，停车卡是在您进入地下停车场时由保安人员直接现场发放的，如没有发放给您请直接联系保安人员。
20,哪儿可以盖停车章,您好，您可以到咨询台盖停车章。
21,哪儿可以吸烟,您好，大厅正门外右侧5米有设置专门的吸烟室可吸烟。
22,公积金在哪儿交,您好，公积金请前往观山湖区社保网点交纳，位于贵阳市观山湖区市级行政中心二期办公楼A区负一楼（西南美食城处），电话咨询请拨打：0851-86851072。
23,取的号要等多久,您好，您可以通过扫描大厅二维码关注政务服务中心公众号关注或下载APP安装后用手机直接查看排队叫号进程，自行安排办理时间。
24,哪儿可以扫描,您好，从大厅正门处出门右转200米，对直下楼梯即有打印店可扫描资料。
25,哪儿可以打印,您好，大厅有配备自助打印机，您可自行打印，或从大厅正门处出门右转200米，下楼梯后即有打印店。
26,网络取号怎么取,您好，您可以通过扫描大厅二维码关注政务服务中心公众号或下载APP安装后便可开始网上取号。
27,大厅有咨询电话吗,您好，大厅咨询电话为0851-84878108。
28,在哪儿投诉,您好，投诉请前往大厅后台投诉室，按照大厅指示牌导引，从大厅入口处直行-右转-直行即到；您也可拨打0851-84878107大厅投诉电话直接进行投诉。
29,在哪儿可以写意见建议\投诉,您好，大厅咨询台处有投诉意见薄可直接填写您的意见建议和投诉。
30,在哪儿可以写表扬,您好，大厅咨询台处有表扬薄可直接填写您对窗口人员的表扬。
31,住建局大厅在哪儿,您好，大厅正门处左转5米为不动产大厅。
32,酒类流通许可证在哪儿办,您好，相关事宜请到本栋大厦2楼社会事务局咨询，您也可拨打：0851-84700736咨询办理。
33,大厅办公/上班/下班时间,您好，大厅正常办公时间为早上九点至下午五点，中午有值班窗口持续办理业务。
34,社会事务局在几楼,您好，在本栋大厦2楼，坐电梯前往即可。
35,行政审批局（政务服务中心）在几楼、大数据发展办公室在几楼,您好，在本栋大厦15楼，坐电梯前往即可。
36,国土资源分局在几楼,您好，在本栋大厦16楼，坐电梯前往即可。
37,科技创新促进局在几楼,您好，在本栋大厦17楼，坐电梯前往即可。
38,创业服务中心在几楼,您好，在本栋大厦18楼，坐电梯前往即可。
39,投资促进局在几楼,您好，在本栋大厦18楼，坐电梯前往即可。
40,质监分局、工商分局在几楼,您好，在本栋大厦19楼，坐电梯前往即可。
41,规划建设局在几楼,您好，在本栋大厦20楼，坐电梯前往即可。
42,产业发展局在几楼,您好，在本栋大厦20楼，坐电梯前往即可。
43,财政局在几楼,您好，在本栋大厦21楼，坐电梯前往即可。
44,监察审计局在几楼,您好，在本栋大厦21楼，坐电梯前往即可。
45,组织与人力资源部在几楼,您好，在本栋大厦21楼，坐电梯前往即可。
46,党政办在几楼,您好，在本栋大厦22楼，坐电梯前往即可。
47,大厅中午休息吗,您好，大厅中午12:00至13:00有值班窗口，下午13:00全部返岗办公。
48,下午几点钟上班,您好，大厅中午12:00至13:00有值班窗口，下午13:00全部返岗办公。
49,观山湖区政务服务大厅在哪儿,您好，观山湖区政务服务大厅位于长岭南路绿地环保对面，您也可拨打：0851-84856498咨询办理。
50,麒龙商务港在哪儿,您好，麒龙商务港位于观山湖阳关大道与210国道交汇处。
51,在哪儿取号,您好，大厅咨询台周围有三台取号机均可取号，您也可以扫描二维码关注政务服务中心公众号或下载APP取号。
52,过号了怎么办,您好，过号后10分钟内可在大厅取号机上重新激活，激活后系统将优先叫号，超过10分钟将不能激活。
53,手机取号了还要打印纸质号吗,您好，网络取号可凭手机上取的号码直接到窗口办理，不需打印纸质号。
54,手机取号的截图可以办理吗,抱歉，手机截图窗口不予以接待办理。
55,大厅什么时候上班,您好，大厅工作日内上午9:00-下午17:00为正常办公时间。
56,什么时候可以取号,您好，工作日内上午9:00-下午17:00为取号时间，网络取号时间提前半小时，如需咨询请拨打：0851-84878108咨询办理。
57,怎么手机显示不能取号了,您好，如您已被锁号或超过当日网络取号时间，网络取号将自动关闭，您可以在大厅取号机上取号，如需咨询请拨打：0851-84878108咨询办理。
58,手机上怎么看办到多少号了,您好，登录取号界面后将自动显示大厅叫号情况并会实时更新，如需咨询请拨打：0851-84878108咨询办理。
59,大厅可以上网/下载吗,您好，按照大厅指示牌导引，由大厅正门进入后右转的24小时自助服务区及全程电子化服务专区，均配备了大量电脑，您可自行登录使用。
60,24小时自助服务区有人引导吗,您好，24小时自助服务区在正常办公时间有专人指导，其他时段您可以根据自助机器上方的PPT指引操作。
61,大厅在什么位置,你好，高新区政务服务大厅位于贵州省贵阳市阳关大道110号，如需咨询请拨打：0851-84878108咨询办理。
62,网上取的号在哪儿打印,您好，网络取号可凭手机上取的号码直接到窗口办理，不需打印纸质号。
63,微企办在哪儿,您好，在本栋大厦19楼，与工商局在一起，坐电梯前往即可。
64,税务后台办公室在哪儿,您好，在大厅后台审批办公室处，按照大厅指示牌导引，从大厅入口处直行穿过33号窗口旁边通道，右转正数第二间即是。
65,税务表格怎么填，有模板吗,您好，税务表格填写可直接到大厅1号窗口咨询，同时1号窗口处配有表格模板，如需咨询请拨打电话：0851-84878115。
66,金税盘在哪儿办理,您好，请前往105票证室办理（18号窗口正对面)。
67,缴税在哪家银行都行吗,您好，您可以前往贵阳银行缴纳税款，从大厅正门出门右转即到。
68,缴税可以付现金吗,您好，大厅窗口不收取现金，您可在大厅窗口刷卡或前往大厅旁边贵阳银行缴纳，如需咨询请拨打电话：0851-84878115。。
69,购买发票/三证合一/税务登记/开发票要怎么办理,您好，税务部门业务可前往大厅1号窗口直接咨询，办理请取号，待叫号后前往相应窗口办理业务，如需咨询请拨打电话：0851-84878115。。
70,办理税务业务到哪儿,您好，大厅2-4、21、22、26-32号均是税务窗口，以上窗口都可以办理，如需咨询请拨打电话：0851-84878115。
71,税务专管员去哪找,您好，税务专管员在本栋大厦17楼税务局，坐电梯前往即可。
72,能交车购税吗,您好，交车购税请前往大厅21、22号窗口咨询办理。
73,减免税怎么办,您好，请前往大厅1号窗口直接咨询，办理请取号，待叫号后前往相应窗口办理业务，如需咨询请拨打电话：0851-84878115。
74,缴纳罚款在哪儿,您好，在税务部门办理，办理请取号，待叫号后前往相应税务服务窗口办理业务，如需咨询请拨打电话：0851-84878115。
75,开户行录入怎么办,您好，咨询请直接前往大厅1号窗口，办理请取号，待叫号后前往相应窗口办理业务，如需咨询请拨打电话：0851-84878115。
76,代开发票怎么办,您好，金额十万元以下发票请在大厅自助开票机上开具（24小时自助服务区内），超过十万元请取号到窗口咨询办理。
77,自助开票机怎么用,您好，请将身份证在自助开票机刷卡处刷卡，然后按照机器显示的办理步骤开具即可。
78,三方协议在怎么办,您好，请前往大厅1号窗口直接咨询，办理请取号，待叫号后前往相应窗口办理业务。
79,外出经营证明在哪儿办,您好，请取号到税收服务窗口按号办理，如需咨询请拨打电话：0851-84878115。
80,税务局窗口电话是多少,您好，税务局窗口电话为0851-84878115
81,工商局调档案去哪儿办,您好，在本栋大厦19楼工商局档案室办理，坐电梯前往即可。
82,办理营业执照的相关业务到哪儿,您好，6、7、8号是市场准入类窗口，专门负责营业执照事宜，相关业务请取号后前往窗口咨询办理或拨打咨询电话：0851-84878106。
83,办理营业执照相关业务需要的资料在哪下载,您好，所需资料表格请前往6、7、8号市场准入类窗口直接领取，如需咨询请拨打电话：0851-84878106。
84,市场准入类窗口电话是多少,您好，市场准入类窗口电话为0851-84878106
85,营业执照相关业务的表格怎么填写，有模板吗,您好，表格填写可直接到6、7、8号窗口咨询，大厅填单台上均有模板，如需咨询请拨打电话：0851-84878106。
86,查公司章程在哪儿查,您好，在本栋大厦19楼工商局档案室办理，坐电梯前往即可。
87,名称预核准在哪办,您好，请前往6号窗口咨询办理，如需电话咨询请拨打：0851-84878106。
88,安装电梯的证明在哪儿办,您好，5号窗口是经济社会类窗口，相关业务请取号后前往窗口咨询办理，如需电话咨询请拨打：0851-84878127。
89,经济社会类窗口电话是多少,您好，经济社会类窗口电话为0851-84878127
90,沙文创业园是不是高新区管辖,您好，沙文创业园是由高新区管辖，地址位于贵阳市白云区沙文镇。
91,我想在高新区投资找哪个部门，有哪些优惠政策,您好，相关事宜您可以到大厅14号招商代办政策服务窗口咨询办理，如需电话咨询请拨打：0851-84875746。
92,办理投资促进局业务到哪儿,您好，14号窗口是投资促进局窗口，相关业务请取号后前往窗口咨询办理，如需电话咨询请拨打：0851-84875746。
93,引进的人才有什么优惠政策吗,您好，相关事宜您可以到大厅14号招商代办政策服务窗口咨询办理，如需电话咨询请拨打：0851-84875746。
94,招商代办政策服务窗口/投资促进局窗口电话是多少,您好，投资促进局窗口电话为0851-84875746
95,施工许可证在哪办,您好，请取号后前往11号工程项目窗口咨询办理，如需电话咨询请拨打：0851-84878110。
96,工程项目窗口电话是多少,您好，工程项目窗口电话为0851-84878110
97,办理刻章到哪儿,您好，33号窗口是印章刻制窗口，相关业务请取号后前往窗口咨询办理。
98,办理征信/信用评级到哪儿,您好，35号窗口是企业征信窗口，相关业务请取号后前往窗口咨询办理。
99,大厅有代理服务吗,您好，34号窗口是企业代办窗口，相关业务请取号后前往窗口咨询办理。
100,刻章取什么号,您好，刻章请取“机构事项-中介服务”，然后按照您所需办理事项取号办理。
101,办理征信/信用评级取什么号,您好，办理征信/信用评级请取“机构事项-中介服务”，然后按照您所需办理事项取号办理。
102,办理代理服务取什么号,您好，办理代理服务请取“机构事项-中介服务”，然后按照您所需办理事项取号办理。